{
  "id": "scene_chapter_hook_001",
  "scene": "chapter_hook",
  "goal": "把章尾写成具体驱动力，让下一章行动被钩子真正拖动，而不是只做空断尾。",
  "steps": [
    "先判断本章结尾后的主问题是什么",
    "再把钩子落成结果、危机、选择、反转、关系、资源或欲望中的一种",
    "再补清楚人、事、风险或代价",
    "最后确认下一章会因此改变行动，而不是只是情绪延长"
  ],
  "avoid": [
    "只写危险逼近",
    "只靠最后一行来人了",
    "钩子和本章功能无关"
  ],
  "applicable_genres": [
    "玄幻/修仙",
    "都市/系统流",
    "末世",
    "历史/权谋",
    "悬疑/推理",
    "甜宠/总裁文"
  ],
  "notes": [
    "适合章节收尾发平、钩子重复、需要强行拉出下一章行动时使用"
  ]
}
