{
  "id": "scene_golden_three_progress_001",
  "scene": "golden_three_progress",
  "goal": "让黄金三章真正形成递进，不把前三章写成同一层卖点的重复播放。",
  "steps": [
    "第1章先立当前问题和入场抓手",
    "第2章必须让主角开始行动、入局或破局",
    "第3章必须抬出长期承诺、阶段目标或更大对手",
    "第3章结尾挂强钩子，把读者稳稳拖向第4章"
  ],
  "avoid": [
    "三章都只在重复同一种压迫或异常",
    "第2章没有真正推进局面",
    "第3章没有长期承诺，只是重复第一章卖点"
  ],
  "applicable_genres": [
    "玄幻/修仙",
    "都市/系统流",
    "末世",
    "历史/权谋",
    "悬疑/推理",
    "甜宠/总裁文"
  ],
  "notes": [
    "适合 `/一键开书`、开篇修章、前三章复盘"
  ]
}
