{
  "id": "scene_daily_001",
  "scene": "daily",
  "goal": "把日常写得有推进，不落成流水账，也不把温度写成空泛治愈感。",
  "steps": [
    "先给当下具体事务",
    "再给人物互动或状态变化",
    "再给一处新信息、新选择或小范围得失变化",
    "最后留轻钩子"
  ],
  "avoid": [
    "纯生活流水账",
    "只有温度没有变化",
    "删掉整段也不影响后文"
  ],
  "applicable_genres": [
    "种田文",
    "都市/系统流"
  ]
}
