{
  "id": "scene_cultivation_breakthrough_001",
  "scene": "cultivation_breakthrough",
  "goal": "把突破场景写出阻力、代价和兑现，而不是只宣布升级成功。",
  "steps": [
    "先给瓶颈或规则阻力",
    "再给身体负荷或灵气异动",
    "接着落突破瞬间的变化",
    "最后给战力、视野或身份层面的反馈"
  ],
  "avoid": [
    "只写主角忽然悟了",
    "只写光芒万丈没有代价",
    "突破后没有任何现实结果"
  ],
  "applicable_genres": [
    "玄幻/修仙"
  ],
  "notes": [
    "适用于境界突破、功法进阶、血脉觉醒等场景。"
  ]
}
