{
  "id": "scene_farming_progress_001",
  "scene": "farming_progress",
  "goal": "把种田日常写成可见积累，而不是平铺流水账。",
  "steps": [
    "先给手头缺口或今日目标",
    "再给劳作、经营或协作细节",
    "接着落一项具体收益",
    "最后挂出下一轮更大的生活压力或机会"
  ],
  "avoid": [
    "从头到尾只有闲聊没有变化",
    "只写环境很美不写收获",
    "每天都像同一天"
  ],
  "applicable_genres": [
    "种田文"
  ],
  "notes": [
    "适用于播种、收获、开铺子、接订单、修房子等场景。"
  ]
}
