{
  "id": "scene_apocalypse_scarcity_001",
  "scene": "apocalypse_scarcity",
  "goal": "把末世压力写成资源、时间和人心的三重挤压。",
  "steps": [
    "先给缺口：物资、药品、弹药或电力",
    "再给外部威胁或倒计时",
    "接着让角色作出取舍",
    "最后明确新代价或新的生路"
  ],
  "avoid": [
    "只写怪物可怕",
    "全队一直慌但没有决策",
    "找到物资后没有后果"
  ],
  "applicable_genres": [
    "末世"
  ]
}
