{
  "id": "scene_pressure_001",
  "scene": "pressure",
  "goal": "制造压迫感，但不依赖抽象大词堆砌。",
  "steps": [
    "先给异常细节",
    "再给角色身体反应",
    "再给动作受阻或选择压力",
    "最后落明确风险"
  ],
  "avoid": [
    "作者直接宣布压迫感",
    "连续堆叠抽象形容词",
    "没有动作就长篇渲染"
  ],
  "applicable_genres": [
    "玄幻/修仙",
    "末世",
    "悬疑/推理"
  ],
  "notes": [
    "适合修复氛围硬、旁白重、角色感知弱的问题"
  ]
}
