{
  "id": "scene_system_reward_001",
  "scene": "system_reward",
  "goal": "把系统提示转化成现实反馈，不让面板播报吃掉戏剧性。",
  "steps": [
    "先交代当前缺口或冲突",
    "再给系统提示的核心条目",
    "接着判断奖励如何立刻生效",
    "最后落到现实人事物的变化"
  ],
  "avoid": [
    "整段复制面板",
    "奖励很多却改变不了眼前局面",
    "只顾震惊不执行"
  ],
  "applicable_genres": [
    "都市/系统流"
  ]
}
