{
  "id": "scene_romance_001",
  "scene": "romance",
  "goal": "制造暧昧或心动，但情绪必须落在互动和边界变化上。",
  "steps": [
    "先给距离变化",
    "再给微动作或目光",
    "再给试探或误读",
    "最后留下关系余波"
  ],
  "avoid": [
    "只写心动",
    "没有互动只有独白",
    "用抽象情话代替关系推进"
  ],
  "applicable_genres": [
    "甜宠/总裁文",
    "言情",
    "校园/青春成长",
    "仙侠恋爱/古言甜虐"
  ],
  "notes": [
    "适合暧昧、拉扯、偏爱、误会解除前后"
  ]
}
