{
  "id": "scene_opening_grab_001",
  "scene": "opening_grab",
  "goal": "把开篇段落写出立即入场的抓力，让读者先看见当前问题，而不是先掉进背景说明。",
  "steps": [
    "先给眼前异常、压迫、机会或羞辱中的一个",
    "再给主角此刻最直接的损失、缺口或压力",
    "再给一次判断、动作或被迫反应",
    "最后留下具体问题，逼读者继续看"
  ],
  "avoid": [
    "先讲大设定再讲当前问题",
    "只有气质没有事件",
    "主角只是被动承受，没有任何判断或动作"
  ],
  "applicable_genres": [
    "玄幻/修仙",
    "都市/系统流",
    "末世",
    "历史/权谋",
    "悬疑/推理"
  ]
}
