{
  "id": "scene_danger_001",
  "scene": "danger",
  "goal": "制造明确危险感，让读者知道风险正在逼近，而不是只感到抽象紧张。",
  "steps": [
    "先给危险征兆",
    "再给角色即时判断",
    "再给动作或选择受限",
    "最后落具体代价"
  ],
  "avoid": [
    "只说危险很近",
    "没有风险来源",
    "没有代价只有气氛"
  ],
  "applicable_genres": [
    "玄幻/修仙",
    "末世",
    "悬疑/推理",
    "都市/系统流"
  ]
}
